{
    "id": "application:${app-name}:${app-version}",
    "name": "app-name",
    "version": "app-version or 'unknown'",
    "components": [ {
        "id": "component_id_1",
        "name": "microservice name",
        "owner": "owner_name",
        "dnsName": "component-1-dns-name",
        "domain": "domain-name",
        "description": "Some human-readable description",
        "type": "backend",
        "framework": "framework name and version, e.g.: 'SpringBoot 2.6.9'",
        "queue": [ {
            "name": "topic1",
            "type": "Kafka",
            "role": "producer"
        }, {
            "name": "topic2",
            "type": "RabbitMQ",
            "role": "consumer"
        }],
        "database": [ {
            "name": "PostgreSQL",
            "version": "15"
        } ],
        "language": [
            "TypeScript"
        ],
        "thirdparty": {
            "SOMETHING": {"version": ""}
        },
        "dependency": {
            "startup": [
                "component-2-dns-name"
            ],
            "mandatory": [
                "component-3-dns-name"
            ],
            "optional": [
                "component-4-dns-name",
                "component-5-dns-name"
            ]
        },
        "documentation": [
            "(URLs to the documentation (Confluence or Git))"
        ],
        "openAPI": true,
        "openAPIpublished": [
            "https://git.your.host/path/component-4/-/tree/main/component-4-spec/src/main/resources/path"
        ],
        "multitenancy": {
            "defaultTenantId": true
        }
    },
    {
        "id": "component_id_2",
        "name": "component_2_name",
        "owner": "owner_name",
        "dnsName": "component-2-dns-name",
        "domain": "domain-name",
        "description": "Some human-readable description",
        "type": "backend",
        "framework": "SpringBoot 2.6.9",
        "language": [
            "TypeScript"
        ],
        "dependency": {
            "startup": [
                "component-3-dns-name"
            ],
            "mandatory": [
                "component-4-dns-name"
            ],
            "optional": [
                "component-5-dns-name",
                "component-6-dns-name"
            ]
        },
        "documentation": [
            "(URLs to the documentation (Confluence or Git))"
        ],
        "openAPI": true,
        "openAPIpublished": [
            "https://git.your.host/path/component-5/-/tree/main/component-4-spec/src/main/resources/path"
        ],
        "multitenancy": {
            "defaultTenantId": true
        }
    } ]

}